project_id,status,year_comp,area_ha,proj_name,proj_part,street_num,street_name,street_type,add_misc,suburb,detached,townhouses,apartments,unknown,att_1s,att_2_3s,att_4s,total_dwel,max_storeys,lga,region,file_year,x_id,identifier,w_id,group_id,isec_area_ha,flag,isec_pct,notes
R06361,Completed,2012,17.01,Janefield,NA,NA,NA,Road,NA,Bundoora,0,NA,NA,0,0,350,0,350,NA,Whittlesea,North,2013,1741,NA NA,1642,126,0.694714547,keep,4.081649534,
R17128,Completed,2019,0.69471455,Janefield Drive Townhouses,Part 1,33,Janefield,Road,NA,Bundoora,0,31,0,0,NA,NA,NA,31,2,WHITTLESEA,Northern,2020,4411,33 janefield,4312,126,0.694714547,keep,100,Project names and site sizes make it clear that additional development on same overall site
R0796,Completed,2004,4.39,Gas & Fuel site,None,36-58,Macaulay,Road,NA,NORTH MELBOURNE,0,NA,NA,0,0,0,260,260,NA,Melbourne,Inner,2004,65,36-58 macaulay,15,127,0.812248408,keep,18.46983208,
R11446,Completed,2019,0.81230265,Canning and Vaughan,NA,101-133,Canning,Street,NA,North Melbourne,0,0,292,0,NA,NA,NA,292,16,MELBOURNE,Inner,2020,4415,101-133 canning,4316,127,0.812248408,keep,99.9933216,Google Earth checked; additional development on same overall site
R11663,Completed,2016,0.14674671,New Street Apartments,NA,2,Well,Street,& 190-192 New St,Brighton,0,0,27,0,NA,NA,NA,27,3,Bayside,Inner South East Region,2017,2972,2 well,2873,128,0.145535439,discard,99.17458118,
R17480,Completed,2020,0.14589334,NEW AND WELL STREETS APARTMENTS,NA,NA,NEW,STREET,NA,BRIGHTON,0,0,27,0,NA,NA,NA,27,3,BAYSIDE,Inner South East,2021,4457,NA new,4358,128,0.145535439,keep,99.75468974,"Same site, address change"
R12218,Completed,2017,0.39561015,Landcox Street Townhouses,NA,15,Landcox,Road,NA,Brighton East,0,25,0,0,NA,NA,NA,25,2,BAYSIDE,Inner South East,2018,3394,15 landcox,3295,129,0.389048152,keep,98.34129797,
R17484,Completed,2020,0.38914457,LANDCOX STREET DWELLINGS,NA,17-21,LANDCOX,STREET,NA,BRIGHTON EAST,20,0,0,0,NA,NA,NA,20,2,BAYSIDE,Inner South East,2021,4458,17-21 landcox,4359,129,0.389048152,discard,99.97522016,"Google Earth checked; actually completed in 2017, but 17-21 is the correct address (15 is an undeveloped house) ; looks like recorded as a new project because of incorrect address being used before"
R16125,Completed,2017,0.12078658,NA,NA,45112,Orr,Street,NA,Heidelberg Heights,0,12,0,0,NA,NA,NA,12,2,BANYULE,Northern,2018,3357,5-7 orr,3258,130,0.120786577,keep,100,
R17790,Completed,2020,0.1214999,ORR STREET TOWNHOUSES,NA,NA,ORR,STREET,NA,HEIDELBERG HEIGHTS,0,12,0,0,NA,NA,NA,12,2,BANYULE,Northern,2021,4467,NA orr,4368,130,0.120786577,discard,99.41289913,Google Earth checked; actually completed 2017; looks like discovering project name (and not knowing address) has caused it to be re-recorded
R16393,Completed,2017,0.213526,Cirqua Apartments,NA,204-206,Lower Heidelberg ,Road,NA,Ivanhoe East,0,0,42,0,NA,NA,NA,42,3,BANYULE,Northern,2018,3364,204-206 lower heidelberg ,3265,131,0.213525535,keep,99.99978692,
R17794,Completed,2020,0.29654691,NA,NA,NA,LOWER HEIDELBERG,ROAD,NA,IVANHOE EAST,0,0,44,0,NA,NA,NA,44,0,BANYULE,Northern,2021,4468,NA lower heidelberg,4369,131,0.213525535,discard,72.00396555,Google Earth checked; actually completed 2017; looks like re-recorded because of failure to match address; R17794 discarded in both groups 131 and 132
R10939,Completed,2016,0.08298266,Cirqua,NA,204-208,Lower Heidelberg,Road,NA,Ivanhoe East,0,0,14,0,NA,NA,NA,14,4,Banyule,Northern Region,2017,3202,204-208 lower heidelberg,3103,132,0.08290904,keep,99.9112814,
R17794,Completed,2020,0.29654691,NA,NA,NA,LOWER HEIDELBERG,ROAD,NA,IVANHOE EAST,0,0,44,0,NA,NA,NA,44,0,BANYULE,Northern,2021,4468,NA lower heidelberg,4369,132,0.08290904,discard,27.95815329,Google Earth checked; actually completed 2017; looks like re-recorded because of failure to match address; R17794 discarded in both groups 131 and 132
R09345,Completed,2015,0.06,Cape Street Apartments,NA,119,Cape,Street,NA,Heidelberg,0,NA,NA,0,0,12,0,12,NA,Banyule,North,2016,2676,119 cape,2577,133,0.063413103,keep,99.6947559,
R17795,Completed,2020,0.06377132,NA,NA,NA,CAPE,STREET,NA,HEIDELBERG,0,0,14,0,NA,NA,NA,14,0,BANYULE,Northern,2021,4469,NA cape,4370,133,0.063413103,discard,99.4382704,Google Earth checked; actually completed 2015 rather than 2020; perhaps rerecorded because of failure to match address
R11600,Completed,2016,0.10426983,Lower Plenty Road Apartments,NA,172,Lower Plenty,Road,NA,Rosanna,0,0,12,0,NA,NA,NA,12,3,Banyule,Northern Region,2017,3168,172 lower plenty,3069,134,0.103670016,keep,99.42474661,
R17799,Completed,2020,0.10370955,LOWER PLENTY ROAD APARTMENT BUILDING ROSANNA,NA,NA,LOWER PLENTY,ROAD,NA,ROSANNA,0,0,12,0,NA,NA,NA,12,3,BANYULE,Northern,2021,4471,NA lower plenty,4372,134,0.103670016,discard,99.961879,Google Earth checked; actually completed 2016 rather than 2020; perhaps rerecorded because of failure to match address
R05362,Completed,2010,5.16,Lancaster Gate,NA,NA,Plenty,Road,NA,Bundoora,40,NA,NA,0,0,0,0,40,NA,Darebin,North,2011,1258,NA plenty,1159,135,0.146202882,keep,2.830478434,
R16659,Completed,2021,0.1943838,Gonella Circuit Townhouses,NA,NA,Gonella,Crescent,NA,BUNDOORA,0,0,10,0,NA,NA,NA,10,2,DAREBIN,Northern,2021,4669,NA gonella,4570,135,0.146202882,keep,75.21350891,Project names and site sizes make it clear that additional development on same overall site
R05362,Completed,2010,5.16,Lancaster Gate,NA,NA,Plenty,Road,NA,Bundoora,40,NA,NA,0,0,0,0,40,NA,Darebin,North,2011,1258,NA plenty,1159,136,0.162533119,keep,3.146630774,
R16665,Completed,2021,0.27528545,Galileo Gateway Townhouses,NA,NA,Galileo,Gateway,NA,BUNDOORA,0,14,0,0,NA,NA,NA,14,2,DAREBIN,Northern,2021,4671,NA galileo,4572,136,0.162533119,keep,59.04166616,Project names and site sizes make it clear that additional development on same overall site
R14259,Completed,2017,0.23107712,NA,NA,45140,Dart,Street,NA,Highett,0,43,0,0,NA,NA,NA,43,5,BAYSIDE,Inner South East,2018,3567,2-8 dart,3468,137,0.231061149,keep,99.99308586,
R17497,Completed,2021,0.23142849,DART STREET APARTMENTS,NA,6,MAJOR,Street,NA,HIGHETT,0,0,45,0,NA,NA,NA,45,3,BAYSIDE,Inner South East,2021,4715,6 major,4616,137,0.231061149,discard,99.84127089,"Same site, address change (but Dart St is the correct address); Google Earch checked; looks complete by 2017"
R00611,Completed,2008,4.69,Essence Estate,NA,81-87,Mitchell,Street,NA,Maidstone,80,NA,NA,0,0,20,0,100,NA,Maribyrnong,West,2011,1124,81-87 mitchell,1025,138,0.183287703,keep,3.906748651,
R13769,Completed,2020,0.18537237,NA,NA,49,Rosamond,Road,NA,MAIDSTONE,0,14,0,0,NA,NA,NA,14,2,MARIBYRNONG,Western,2021,4831,49 rosamond,4732,138,0.183287703,keep,98.87541373,Site sizes indicate separate development on same overall site
R00811,Completed,2004,0.2,NA,None,97-111,Franklin,Street,NA,Melbourne,0,NA,NA,0,0,21,0,21,NA,Melbourne,Inner,2005,239,97-111 franklin,140,139,0.199604511,keep,99.61953964,
R12621,Completed,2021,0.20017827,NA,NA,97-111,Franklin,Road,NA,MELBOURNE,0,0,142,0,NA,NA,NA,142,60,MELBOURNE,Inner,2021,4908,97-111 franklin,4809,139,0.199604511,keep,99.71337562,Google Earth checked; 2021 is correct; evidence of previous development in 2005 is difficult to see but could well have been some redevelopment on this inner city site
R01034,Completed,2004,27.51,The Village Glen Community Village,None,45080,Brickendon,Drive,NA,Rosebud West,101,NA,NA,0,0,0,0,101,NA,Mornington Peninsula,South,2007,493,3-6 brickendon,394,140,0.328165458,keep,1.191608141,
R17340,Completed,2021,0.32816547,335 Eastbourne,NA,335,Eastboourne,Road,NA,CAPEL SOUND,0,0,16,0,NA,NA,NA,16,3,MORNINGTON PENINSULA,Southern,2021,4944,335 eastboourne,4845,140,0.328165458,keep,100,Site sizes and project names indicate separate development on same overall site
R03361,Completed,2004,12.36,Edgewater Estate,Stage 1,NA,Gordon,Street,NA,Maribyrnong,0,NA,NA,150,0,0,0,150,NA,Maribyrnong,West,2005,304,NA gordon,205,141,0.285789383,keep,2.31177498,already kept in group 58
R08918,Completed,2013,11.39,Edgewater Estate B1,NA,NA,Edgewater,Boulevard,NA,Maribyrnong,0,NA,NA,0,0,177,0,177,NA,Maribyrnong,Inner,2014,2068,NA edgewater,1969,141,0.285789383,keep,2.507492471,already kept in group 58
R18050,Completed,2021,0.2914812,NA,NA,449,GORDON,STREET,NA,MARIBYRNONG,0,20,0,0,NA,NA,NA,20,3,MARIBYRNONG,Western,2021,4963,449 gordon,4864,141,0.285789383,keep,98.04727972,Google Earth checked; new development on same larger site as the group 58 projects
